Link Product Page,title,ID,Stars out of 5,Reviewer Count
https://www.amazon.ae/sspa/click?ie=UTF8&spc=MTo4NjY4MDMzOTU5MzcxMjM2OjE2ODY1NTY0MjU6c3BfYXRmX2Jyb3dzZToyMDE0ODgzMjkwOTI5ODo6MDo6&url=%2FMothers-Necklace-Women%25EF%25BC%258CMothers-Remember-Daughters%2Fdp%2FB0BZQ1VGG8%2Fref%3Dsr_1_1_sspa%3Fqid%3D1686556425%26s%3Dfashion%26sr%3D1-1-spons%26sp_csd%3Dd2lkZ2V0TmFtZT1zcF9hdGZfYnJvd3Nl%26psc%3D1,"Happy Mother's Day,Mom Necklace, Fashion Jewelry Gifts for Women，Mothers Day gifts， Remember I love you Mom ring key chain from Daughters and Sons",1,No reviewer,No reviewer
https://www.amazon.ae/sspa/click?ie=UTF8&spc=MTo4NjY4MDMzOTU5MzcxMjM2OjE2ODY1NTY0MjU6c3BfYXRmX2Jyb3dzZToyMDE2NzA5Njc5NTA5ODo6MDo6&url=%2FBracelet-Adjustable-Friendship-Fashion-Birthday%2Fdp%2FB0BX82DF2C%2Fref%3Dsr_1_2_sspa%3Fqid%3D1686556425%26s%3Dfashion%26sr%3D1-2-spons%26sp_csd%3Dd2lkZ2V0TmFtZT1zcF9hdGZfYnJvd3Nl%26psc%3D1,"Women's Silver Bracelet Star Charm Bracelet Gifts for Women Adjustable Bangle girls, Ladies Friendship Bracelet, Fashion Jewelry Birthday Gifts for Women girls",2,5,1
https://www.amazon.ae/sspa/click?ie=UTF8&spc=MTo4NjY4MDMzOTU5MzcxMjM2OjE2ODY1NTY0MjU6c3BfYXRmX2Jyb3dzZToyMDE2NzA5Njc5NDk5ODo6MDo6&url=%2FBracelets-Bracelet-Exquisite-Fashion-Birthday%2Fdp%2FB0C369YNNG%2Fref%3Dsr_1_3_sspa%3Fqid%3D1686556425%26s%3Dfashion%26sr%3D1-3-spons%26sp_csd%3Dd2lkZ2V0TmFtZT1zcF9hdGZfYnJvd3Nl%26psc%3D1%26smid%3DA1AYTBNTE0T6K9,"Women's Bracelets Women's Heart Bracelet, S925 Silver Bangle An Exquisite Bracelet Fashion Jewelry Birthday Wedding Gift for Girls Women Wife Mom",3,No reviewer,No reviewer
https://www.amazon.ae/sspa/click?ie=UTF8&spc=MTo4NjY4MDMzOTU5MzcxMjM2OjE2ODY1NTY0MjU6c3BfYXRmX2Jyb3dzZToyMDE2NzA5Njc5NTM5ODo6MDo6&url=%2FBracelets-Zirconia-Classic-Adjustable-Bracelet%2Fdp%2FB0BS12TPF6%2Fref%3Dsr_1_4_sspa%3Fqid%3D1686556425%26s%3Dfashion%26sr%3D1-4-spons%26sp_csd%3Dd2lkZ2V0TmFtZT1zcF9hdGZfYnJvd3Nl%26psc%3D1,Tennis Bracelets for Women White Cubic Zirconia Classic Adjustable Crystal Slider Plated Silver Bracelet Fashion Jewelry Wedding Gift for Girls Women Wife Mom,4,3,2
https://www.amazon.ae/DAIMANPU-Strong-Plating-Magnetic-Accessory/dp/B09C7ZGPLL/ref=sr_1_5?qid=1686556425&s=fashion&sr=1-5,DAIMANPU Strong Metal Plating Magnetic Hijab Clip Safe Hijab Brooch Luxury Accessory No Hole Pins Brooch Magnet for Muslim Scarf,5,4.1,50
https://www.amazon.ae/Ricjurzzty-Bracelets-Natural-Stones-Jewelry/dp/B093XYXL8N/ref=sr_1_6?qid=1686556425&s=fashion&sr=1-6,Ricjurzzty 3 PCS Tiger Eye Stone Bracelets 8MM Natural Stones Beads Bracelets for Men Women Girls Jewelry,6,4.1,99
https://www.amazon.ae/TALITARE-Adjuster-Loose-Rings-silicone/dp/B08L4NH4S3/ref=sr_1_7?qid=1686556425&s=fashion&sr=1-7,"TALITARE Ring Size Adjuster for Loose Rings (Pack of 8,8 Sizes) silicone",7,3.7,33
https://www.amazon.ae/Swarovski-Elements-Sterling-Infinity-J-Ros%C3%A9e/dp/B08JHXQX46/ref=sr_1_8?qid=1686556425&s=fashion&sr=1-8,Swarovski Elements Crystal 18K Gold Plated 925 Sterling Silver Pendant Necklace and Studs Earrings J.Rosée Fashion Jewelry Sets for Women Ladies Girls Gift Package,8,4.2,118
https://www.amazon.ae/Youbella-Jewellery-Bohemian-Multi-Color-Earrings/dp/B01MU6O7H7/ref=sr_1_9?qid=1686556425&s=fashion&sr=1-9,Youbella Jewellery Bohemian Multi-Color Earrings For Girls And Women,9,4,"7,337"
https://www.amazon.ae/Infinity-Friendship-Adjustable-Bracelets-Jewellery/dp/B0B5MT69CW/ref=sr_1_10?qid=1686556425&s=fashion&sr=1-10,"Infinity Bracelet for Women, Silver Gold Plated Bracelet Cubic Zirconia Adjustable Love Heart Bracelets for Women Ladies Jewellery for mom Daughter Girls Gift",10,4,20
https://www.amazon.ae/Necklace-Necklaces-Aesthetic-Accessories-Friendship/dp/B0B9FXB18C/ref=sr_1_11?qid=1686556425&s=fashion&sr=1-11,My Melody And Kuromi Necklace Bff Necklace For 2 Cute Necklaces Aesthetic Pendant Accessories Kawaii Friendship Bestie Best Friend Gift For Teen Girls,11,5,4
https://www.amazon.ae/Necklace-Bracelet-Deathly-Inspired-Collections/dp/B07VMYTMZM/ref=sr_1_12?qid=1686556425&s=fashion&sr=1-12,4 Piece Harry Potter Necklace Bracelet with The Deathly Hallows Golden Snitch Time Turner Chain Pendant Necklace for Harry Inspired Fans Gifts Collections,12,4.1,75
https://www.amazon.ae/Genseion-Bracelets-Earrings-Necklace-Titanium/dp/B0B8QS27MD/ref=sr_1_13?qid=1686556425&s=fashion&sr=1-13,"Genseion Cute Simple 18k Gold Plated Lucky Clover Sets Bracelets Earrings Necklace Pendant for Women, Titanium steel, No Gemstone",13,2.7,6
https://www.amazon.ae/Genseion-Bracelets-Necklace-Titanium-Gemstone/dp/B0B8QTLZ2T/ref=sr_1_14?qid=1686556425&s=fashion&sr=1-14,18k Gold Plated Lucky Clover Sets Bracelets Earring Necklace Pendant for Women Cute Simple Fashion Jewelry Womens Girls Gift,14,2.9,9
https://www.amazon.ae/Big-Little-Sister-Friendship-Necklace/dp/B07M7Y1R96/ref=sr_1_15?qid=1686556425&s=fashion&sr=1-15,Big and Little Sister Friendship Necklace Set of 2 Pcs - Best Friend Gift Necklace,15,4,43
https://www.amazon.ae/Crystals-Swarovski-Classic-Designer-Earrings/dp/B07WYM2WCZ/ref=sr_1_16?qid=1686556425&s=fashion&sr=1-16,Yellow Chimes Women's Crystals from Swarovski Classic Designer Plated Base Metal Stylish Hoop Earrings,16,3.8,"7,022"
https://www.amazon.ae/Goody-1942512-Classics-Small-Multi-Colour/dp/B003YOVCLU/ref=sr_1_17?qid=1686556425&s=fashion&sr=1-17,"Goody 1942512 Classics Small Half Claw Clip, Multi-Colour ' 12 Units",17,4.3,680
https://www.amazon.ae/Beautiful-Classic-Oxidized-Finishing-Piercing/dp/B0837NCX9N/ref=sr_1_18?qid=1686556425&s=fashion&sr=1-18,Yellow Chimes Beautiful Classic Designs 7 Pcs Combo Silver Oxidized Finishing Without Piercing Nose Pins for Women &amp; Girls,18,4,"1,115"
https://www.amazon.ae/ROSENICE-Necklace-Adjustable-Heart-Shaped-Accessories/dp/B07YXVXBCV/ref=sr_1_19?qid=1686556425&s=fashion&sr=1-19,ROSENICE Leather Collar Necklace Adjustable Stylish Female Binding Clavicle Heart-Shaped Gothic Chain Choker Accessories (Black),19,3.8,29
https://www.amazon.ae/Crystal-Necklaces-Necklace-Hexagonal-Gemstone/dp/B09Y2RXRGD/ref=sr_1_20?qid=1686556425&s=fashion&sr=1-20,"3 Pieces Crystal Necklaces, Quartz Pendant Energy Healing Crystal Necklace Natural Hexagonal Gemstone Pendant for Women Girls",20,4,12
https://www.amazon.ae/sspa/click?ie=UTF8&spc=MTo4NjY4MDMzOTU5MzcxMjM2OjE2ODY1NTY0MjU6c3BfbXRmX2Jyb3dzZToyMDE2NzA5Njc5NTU5ODo6MDo6&url=%2FBracelet-bracelet-Stainless-Zirconia-Adjustable%2Fdp%2FB0BC1TC9GM%2Fref%3Dsr_1_21_sspa%3Fqid%3D1686556425%26s%3Dfashion%26sr%3D1-21-spons%26sp_csd%3Dd2lkZ2V0TmFtZT1zcF9tdGZfYnJvd3Nl%26psc%3D1,Women Girls Charm Bracelet Harry Golden Potter Snitch bracelet Stainless steel Silver Wings Bracelet with Zirconia Ladies Jewelry Adjustable - Anniversary Birthday Gifts for girls woman,21,5,1
https://www.amazon.ae/sspa/click?ie=UTF8&spc=MTo4NjY4MDMzOTU5MzcxMjM2OjE2ODY1NTY0MjU6c3BfbXRmX2Jyb3dzZToyMDE2NzA5Njc5NTE5ODo6MDo6&url=%2FBracelets-Zirconia-Classic-Adjustable-Bracelet%2Fdp%2FB0BWW45WHH%2Fref%3Dsr_1_22_sspa%3Fqid%3D1686556425%26s%3Dfashion%26sr%3D1-22-spons%26sp_csd%3Dd2lkZ2V0TmFtZT1zcF9tdGZfYnJvd3Nl%26psc%3D1,Tennis Bracelets for Women White Black Cubic Zirconia Classic Adjustable Crystal Slider Plated Silver Bracelet Fashion Jewelry Wedding Gift for Girls Women Wife Mom,22,No reviewer,No reviewer
https://www.amazon.ae/sspa/click?ie=UTF8&spc=MTo4NjY4MDMzOTU5MzcxMjM2OjE2ODY1NTY0MjU6c3BfbXRmX2Jyb3dzZToyMDEyMDcwMzU1NTE5ODo6MDo6&url=%2FEstele-Plated-Chunky-Boxes-Bracelet%2Fdp%2FB08CZXZRJJ%2Fref%3Dsr_1_23_sspa%3Fqid%3D1686556425%26s%3Dfashion%26sr%3D1-23-spons%26sp_csd%3Dd2lkZ2V0TmFtZT1zcF9tdGZfYnJvd3Nl%26psc%3D1,Estele Gold Plated Chunky Boxes Bracelet,23,3.6,8
https://www.amazon.ae/sspa/click?ie=UTF8&spc=MTo4NjY4MDMzOTU5MzcxMjM2OjE2ODY1NTY0MjU6c3BfbXRmX2Jyb3dzZToyMDE2MTM0NzAwNTg5ODo6MDo6&url=%2FRINGJEWEL-Silver-Moissanite-Earrings-Clarity%2Fdp%2FB0765RVRH6%2Fref%3Dsr_1_24_sspa%3Fqid%3D1686556425%26s%3Dfashion%26sr%3D1-24-spons%26sp_csd%3Dd2lkZ2V0TmFtZT1zcF9tdGZfYnJvd3Nl%26psc%3D1,"RINGJEWEL Silver Plated Round Real Moissanite Stud Earrings (4.42 Ct,Black Color,Opaque Clarity), Moissanite",24,3,1
https://www.amazon.ae/Luxury-Fashion-Jewelry-Bracelet-Stainless/dp/B0B7GWRN78/ref=sr_1_25?qid=1686556425&s=fashion&sr=1-25,Stainless Steel Women Bracelets (cross shape),25,3.8,12
https://www.amazon.ae/f3-Unisex-Bracelet-Black-Free-Size/dp/B07MCMPJFM/ref=sr_1_26?qid=1686556425&s=fashion&sr=1-26,"f3 Unisex Bracelet (Black, Free-Size)",26,3.2,18
https://www.amazon.ae/Adjustable-Waterproof-Friendship-Relationship-Girlfriend/dp/B09T9JK71D/ref=sr_1_27?qid=1686556425&s=fashion&sr=1-27,"2 PCS Yin Yang Bracelets, Matching Couple Cord Bracelet, Adjustable Waterproof Handmade, for Best Friend Friendship Relationship Bracelets, Gift for Girlfriend, Boyfriend to Chistmas,Valentines",27,4.5,2
https://www.amazon.ae/Yellow-Elegant-Butterfly-Crystal-Earrings/dp/B08F72TYQY/ref=sr_1_28?qid=1686556425&s=fashion&sr=1-28,Yellow Chimes Elegant Butterfly Crystal Silver Plated Clip-on Earrings for Women and Girls,28,3.9,410
https://www.amazon.ae/Shoulder-Cascade-Bachelorette-Decorations-Supplies/dp/B07MWJG26H/ref=sr_1_29?qid=1686556425&s=fashion&sr=1-29,Party Bride to Be Satin Sash &amp; Shoulder Length Veil White Double Ribbon Edge Center Cascade Bridal Wedding Veil with Comb&amp; Bride to Be Satin Sash- Bachelorette Party Decorations Supplies,29,4.9,20
https://www.amazon.ae/Yellow-Chimes-Oxidized-Chandbali-Earring/dp/B07MCCN1YY/ref=sr_1_30?qid=1686556425&s=fashion&sr=1-30,Yellow Chimes Modern Fusion Oxidized silver Alloy Chandbali Earring for Women and Girls,30,4,340
https://www.amazon.ae/Necklace-Preserved-Girlfriend-Valentines-Anniversary/dp/B0BBH31NHS/ref=sr_1_31?qid=1686556425&s=fashion&sr=1-31,"Gifts for Women, Eternal Rose with Necklace, Preserved Flower with Pendant, Jewelry Gifts for Wife, Mother, Girlfriend on Valentine's Day, Birthday, Anniversary, Mother's Day",31,3.5,3
https://www.amazon.ae/Ricjurzzty-Butterfly-Necklaces-Friendship-Necklace/dp/B0B57HTCDH/ref=sr_1_32?qid=1686556425&s=fashion&sr=1-32,"Ricjurzzty 2 PCS Butterfly BFF Necklaces, Enamel Butterfly Friendship Necklaces Best Friends Necklace for Teen Girls Women Best Friend Birthday Gift",32,3.3,8
https://www.amazon.ae/Necklace-Pendant-Friendship-Birthday-Valentine/dp/B0BHZBBT97/ref=sr_1_33?qid=1686556425&s=fashion&sr=1-33,"Best Friend Necklace, Half Heart Pendant, Friendship Necklace, BFF Necklace for Valentine Heart Necklace, Sister Necklace Set Jewelry Birthday Valentine Gift for friend",33,4.8,7
https://www.amazon.ae/ORiTi-Surgical-Stainless-Earrings-Hypoallergenic/dp/B09F8PVGCL/ref=sr_1_34?qid=1686556425&s=fashion&sr=1-34,ORiTi 316L Surgical Stainless Steel Stud Earrings Set Small Hoop Earrings Hypoallergenic Tunnel Punk Style Round Ear Piercing Jewelry for Women Mens,34,4.1,21
https://www.amazon.ae/Silver-Friendship-Necklace-friends-forever/dp/B07NDPGWKN/ref=sr_1_35?qid=1686556425&s=fashion&sr=1-35,Alloy Silver Friendship Necklace (best friends forever and ever),35,3.3,17
https://www.amazon.ae/Piercing-Disposable-Earring-Contain-Supplies/dp/B0BFJ6HL1Q/ref=sr_1_36?qid=1686556425&s=fashion&sr=1-36,"Ear Piercing Kit, 4Pack Disposable Self Ear Piercing Gun with Earring Studs, Contain Clean Tool and Piercing Gun(4mm), No Pain Piercing Tool and Piercing Supplies, Silver",36,4.6,3
https://www.amazon.ae/Designer-Zirconia-Bracelet-350Swan-Ycfjbr-350Swan-Bl/dp/B0786J5WVJ/ref=sr_1_37?qid=1686556425&s=fashion&sr=1-37,Yellow Chimes Swan Designer By Yellow Chimes Silver Plated And Cubic Zirconia Charm Bracelet For Women (Blue)(Ycfjbr 350Swan Bl) (Ycfjbr-350Swan-Bl),37,4,558
https://www.amazon.ae/Swarovski-Elements-Sterling-Pendent-Necklace/dp/B07MG8RT4Y/ref=sr_1_38?qid=1686556425&s=fashion&sr=1-38,Swarovski Elements 925 Sterling Silver Pendent Necklace for Women Gift JRosee Jewelry,38,4.2,785
https://www.amazon.ae/Yellow-Chimes-Earrings-Silver-Stainless/dp/B07V6XZGXC/ref=sr_1_39?qid=1686556425&s=fashion&sr=1-39,Yellow Chimes Combo of 3 Pairs Big Hoop Earrings Silver Gold Rose Gold Stainless Steel Ear rings for Women and Girls,39,4.2,"1,978"
https://www.amazon.ae/Choker-Necklaces-Velvet-Stretch-Necklace/dp/B07MX6HTHD/ref=sr_1_40?qid=1686556425&s=fashion&sr=1-40,10 PCS Women Choker Necklaces Black Velvet Stretch Tattoo Choker Necklace Set for Girls,40,4.1,42
https://www.amazon.ae/Estele-plated-round-shaped-earrings/dp/B08CQ7VGGL/ref=sr_1_41?qid=1686556425&s=fashion&sr=1-41,Estele 24Kt Gold Plated Earings for Women,41,3.7,808
https://www.amazon.ae/Fazza-Wristband-Bangle-Bracelet-Unisex/dp/B08Z9XLPMH/ref=sr_1_42?qid=1686556425&s=fashion&sr=1-42,F3 Fazza Faz3 Wristband Rope Bangle Bracelet for Unisex (Light Grey),42,3.7,3
https://www.amazon.ae/Jaffiust-Layered-Rhinestone-Festive-Accessory/dp/B09ZGXZYK5/ref=sr_1_43?qid=1686556425&s=fashion&sr=1-43,Jaffiust Layered Body Chain Rhinestone Bra Chain Festive Summer Beach Bikini Accessory Jewelry for Women and Girls (Type B Gold),43,5,2
https://www.amazon.ae/Yellow-Chimes-Oxidised-Adjustable-Anklets/dp/B089KM3BWL/ref=sr_1_44?qid=1686556425&s=fashion&sr=1-44,Yellow Chimes Latest Trend 5 Pcs Combo Black Thread Knot with Oxidised Single Charms Adjustable Evil Eye Anklets for Women and Girls,44,3.9,"1,791"
https://www.amazon.ae/Rhinestone-Butterfly-Snowflake-Non-Piercing-Earrings/dp/B0B4FJ852D/ref=sr_1_45?qid=1686556425&s=fashion&sr=1-45,Glitter Rhinestone Butterfly Snowflake Ear Cuff 1 Pair Vintage Non-Piercing Fake Earrings Bridal Wedding Climber Ear Wrap Prom Ball Ear Jewelry for Women Girls,45,4.4,3
https://www.amazon.ae/Crystal-Pandora-Elements-Bracelet-Valentines/dp/B07NDQMN6X/ref=sr_1_46?qid=1686556425&s=fashion&sr=1-46,925 Silver Dangle Heart Crystal Beads Charms Pandora Elements Bracelet Valentines Gift,46,3.7,26
https://www.amazon.ae/DESIMTION-Mothers-Daughter-Bracelets-Matching/dp/B08Z3P6WLY/ref=sr_1_47?qid=1686556425&s=fashion&sr=1-47,"Desimtion Mothers Day Gifts,Mother Daughter Bracelets Set for 2,3,4,5,6.Matching Heart Back to School Bracelets for Mommy and Me Easter Gifts for Girl",47,4.2,10
https://www.amazon.ae/Yellow-Elegant-Crystal-Stylish-Earrings/dp/B07Q3GJVXD/ref=sr_1_48?qid=1686556425&s=fashion&sr=1-48,Yellow Chimes Elegant Crystal Drop Silver Tone Stylish Earrings for Women and Girls,48,3.4,586
https://www.amazon.ae/Fashion-Korean-Earrings-Titanium-Magnet/dp/B07MWYFQ76/ref=sr_1_49?qid=1686556425&s=fashion&sr=1-49,2 Pair Fashion Korean Men Stud Earrings Titanium Steel Magnet,49,3.8,21
https://www.amazon.ae/Multilayer-Bracelets-KASTWAVE-Crystal-Bracelet/dp/B09K3GBL4S/ref=sr_1_50?qid=1686556425&s=fashion&sr=1-50,"Multilayer Bracelets, KASTWAVE Crystal Charms Multilayer Bracelets, 3PCS Gold/Silver/Rose Gold Corn Chain Bracelet for Women, Tree of Life Heart Shaped Stretch Bracelet",50,3.5,9
https://www.amazon.ae/Bracelet-Friendship-Bracelets-Adjustable-Multicolore/dp/B0B3LN1533/ref=sr_1_51?qid=1686556425&s=fashion&sr=1-51,Wave Bracelet Braided Rope Friendship Braided Rope Bracelet for Women Colorful Handmade String Wrap Bracelets Adjustable Multicolore Cotton Woven Wrist Anklet Cord Bohemia Jewelry 12 Pcs,51,4.5,2
https://www.amazon.ae/ELECDON-Headband-Rhinestone-Headbands-Accessories/dp/B09HBYNJ4B/ref=sr_1_52?qid=1686556425&s=fashion&sr=1-52,"Silver Tiara, ELECDON Crowns Crystal Headband Princess Rhinestone Crown with Combs Bride Headbands Bridal Wedding Prom Birthday Party Hair Accessories Jewelry for Women Girls",52,4.1,9
https://www.amazon.ae/Stainless-Steel-Belly-Button-Piercing/dp/B07MVP7LJX/ref=sr_1_53?qid=1686556425&s=fashion&sr=1-53,5pcs Stainless Steel Belly Button Rings for Women Girls Navel Rings CZ Body Piercing,53,3.9,13
https://www.amazon.ae/Bivei-Natural-Precious-Gemstone-Bracelet/dp/B08Q7XGRL4/ref=sr_1_54?qid=1686556425&s=fashion&sr=1-54,Natural Semi Precious Gemstone Beads Bracelet for Women - Tree of Life and Leaf Charm Chakra Energy Healing Anxiety Stretch Bracelets,54,4.5,"1,216"
https://www.amazon.ae/FASHIONEEDA-Strongest-Commercial-Accessories-Shape-Set/dp/B09R63KXT5/ref=sr_1_55?qid=1686556425&s=fashion&sr=1-55,"FASHIONEEDA Hijab Pins Magnetic With Strongest Commercial Strength, Hijab Magnets for Women in Hijab Accessories and Pins for Scarf, No Snag Hijab Magnets (Round Shape-Set of 4)",55,4.4,24
https://www.amazon.ae/Personality-Design-Crystal-Pendant-Necklace/dp/B07MG7FR46/ref=sr_1_56?qid=1686556425&s=fashion&sr=1-56,Personality Wolf Tooth Design Black Crystal Pendant Necklace for Men &amp; Women,56,3.3,40
https://www.amazon.ae/sspa/click?ie=UTF8&spc=MTo4NjY4MDMzOTU5MzcxMjM2OjE2ODY1NTY0MjU6c3BfYnRmX2Jyb3dzZToyMDE2MTM0NzAwNTU5ODo6MDo6&url=%2FRINGJEWEL-Moissanite-Solitaire-Engagement-Silver%2Fdp%2FB06XYNP82Q%2Fref%3Dsr_1_57_sspa%3Fqid%3D1686556425%26s%3Dfashion%26sr%3D1-57-spons%26sp_csd%3Dd2lkZ2V0TmFtZT1zcF9idGZfYnJvd3Nl%26psc%3D1,RINGJEWEL 3.18 ct VS1 Round Moissanite Solitaire Engagement Silver Plated Ring Off White Color Size 7,57,No reviewer,No reviewer
https://www.amazon.ae/sspa/click?ie=UTF8&spc=MTo4NjY4MDMzOTU5MzcxMjM2OjE2ODY1NTY0MjU6c3BfYnRmX2Jyb3dzZToyMDEyMDcwMzU1NDk5ODo6MDo6&url=%2FEstele-Toned-Bangle-Bracelet-Women%2Fdp%2FB08CSD5Z7D%2Fref%3Dsr_1_58_sspa%3Fqid%3D1686556425%26s%3Dfashion%26sr%3D1-58-spons%26sp_csd%3Dd2lkZ2V0TmFtZT1zcF9idGZfYnJvd3Nl%26psc%3D1,Estele Gold Toned Bangle Type 1 Bracelet For Women,58,3.8,22
https://www.amazon.ae/sspa/click?ie=UTF8&spc=MTo4NjY4MDMzOTU5MzcxMjM2OjE2ODY1NTY0MjU6c3BfYnRmX2Jyb3dzZToyMDEyMDcwMzU1NTU5ODo6MDo6&url=%2FEstele-plated-Heart-Shaped-Necklace%2Fdp%2FB08D8768YH%2Fref%3Dsr_1_59_sspa%3Fqid%3D1686556425%26s%3Dfashion%26sr%3D1-59-spons%26sp_csd%3Dd2lkZ2V0TmFtZT1zcF9idGZfYnJvd3Nl%26psc%3D1,Estele Necklace Set for Women,59,3.5,387
https://www.amazon.ae/sspa/click?ie=UTF8&spc=MTo4NjY4MDMzOTU5MzcxMjM2OjE2ODY1NTY0MjU6c3BfYnRmX2Jyb3dzZToyMDEyMDcwMzU1MzM5ODo6MDo6&url=%2FEstele-Bangle-Metal-Brass-Bracelet%2Fdp%2FB08CSH5YVW%2Fref%3Dsr_1_60_sspa%3Fqid%3D1686556425%26s%3Dfashion%26sr%3D1-60-spons%26sp_csd%3Dd2lkZ2V0TmFtZT1zcF9idGZfYnJvd3Nl%26psc%3D1,Estele Bangle Metal Brass Bracelet For Women,60,3.3,12
https://www.amazon.ae/Shonyin-Bracelet-Kabbalah-Protection-Bracelets/dp/B08FY55T83/ref=sr_1_53?qid=1686556435&s=fashion&sr=1-53,Shonyin 7 Knots Red String Bracelet Kabbalah Protection Thread Handmade String Bracelets Good Luck Gift for Women Men Girls Boys Family,65,4.5,690
https://www.amazon.ae/Butterfly-Earrings-Flowers-Earring-Piercing/dp/B0BLJWVFHP/ref=sr_1_54?qid=1686556435&s=fashion&sr=1-54,"Butterfly Tassel Style Zircon Earrings, Butterfly Flowers Tassel Long Earring, Shiny Zircon No Piercing Butterfly Ear Clip Jewelry Gifts for Women Girls (Golden Pair)",66,3.4,2
https://www.amazon.ae/PAMP-BAR-SUISSE-24K-5GM/dp/B0BQZY4CQV/ref=sr_1_55?qid=1686556435&s=fashion&sr=1-55,PAMP BAR SUISSE 24K 5GM,67,5,2
https://www.amazon.ae/Handmade-Bracelets-Aesthetic-Bracelet-Accessories/dp/B0BXWSK4WX/ref=sr_1_56?qid=1686556435&s=fashion&sr=1-56,12 Pcs Handmade Boho Bracelets for Women Girls Braided Bracelets Ankle Bracelets Aesthetic Beach Surfer Women Men Bracelet Jewelry Accessories,68,No reviewer,No reviewer
https://www.amazon.ae/Bracelets-Braided-Friendship-Adjustable-Bracelet/dp/B09W45FKWX/ref=sr_1_57?qid=1686556435&s=fashion&sr=1-57,Bracelets Braided Stretch Friendship Braided Rop Bracelets Set 24 Pcs Adjustable Wave Strand Bracelet Summer Anklet Bracelet Thread Bracelets Friendship Jewelry (8 Styles),69,5,2
https://www.amazon.ae/Youbella-WomenS-Plated-Earrings-Jewellery/dp/B08KLNWGJL/ref=sr_1_58?qid=1686556435&s=fashion&sr=1-58,Youbella Girls/Women'S Gold Plated Combo Of 24 Stud Tops Earrings Jewellery (Golden),70,4.1,"1,722"
https://www.amazon.ae/Friendship-Necklaces-Best-Friends-Forever/dp/B09WRLDBVY/ref=sr_1_59?qid=1686556435&s=fashion&sr=1-59,Friendship Necklaces Best Friends Forever: 3 Pcs BFF Necklaces Artificial Donut Shaped Pendant Necklace for Girls Students,71,5,2
https://www.amazon.ae/YAZILIND-Colorful-Festival-Necklace-Gemstone/dp/B07W6YTSVH/ref=sr_1_60?qid=1686556435&s=fashion&sr=1-60,"YAZILIND Ethnic Style Chunky Colorful Collar Festival Tribal Beaded Bib Choker Costume Necklace, No Gemstone",72,4.4,"2,238"
https://www.amazon.ae/Bracelet-Adjustable-Friendship-Boyfriend-Girlfriend/dp/B09WRLBQPB/ref=sr_1_61?qid=1686556435&s=fashion&sr=1-61,"Yin Yang Friend or Couple Bracelet with Necklace Set, 2 Pieces Matching Yin Yang Adjustable Cord Bracelet, 2 Pieces Yin Yang Couple Pendant Necklace Chain for Friendship Boyfriend Girlfriend",73,4.4,7
https://www.amazon.ae/Crown-Bracelet-Black-Matte-Adjustable/dp/B07MWYPMFZ/ref=sr_1_62?qid=1686556435&s=fashion&sr=1-62,Men Crown King Bracelet Black Matte Agate Bracelet Adjustable 8MM Beads,74,3.9,57
https://www.amazon.ae/ORiTi-Surgical-Stainless-Hypoallergenic-Cartilage/dp/B0999RN1TR/ref=sr_1_63?qid=1686556435&s=fashion&sr=1-63,ORiTi Surgical Stainless Steel Small Nose Hoop Earrings 8mm/10mm/12mm Hypoallergenic Earrings Cartilage Helix Lobes Hinged Sleeper Tiny Hoop Earrings Body Piercing Jewelry for Men and Women,75,4,13
https://www.amazon.ae/Best-Friends-Gift-Necklace-Set/dp/B07MG5C6RQ/ref=sr_1_64?qid=1686556435&s=fashion&sr=1-64,Best Friends Gift Necklace Set of 2 - Heart Pendant with Rhinestones,76,3.6,4
https://www.amazon.ae/Charming-Butterfly-Surgical-Earrings-Ycfjer-283Btrf-Rg/dp/B01LWQUG8X/ref=sr_1_65?qid=1686556435&s=fashion&sr=1-65,Yellow Chimes Charming Dual Butterfly Surgical Steel 18K Real Rose Gold Stud Earrings For Girls And Women (Rose Gold) (Ycfjer-283Btrf-Rg),77,4.2,"1,968"
https://www.amazon.ae/Exquisite-Signature-Silicon-Stainless-Bracelet/dp/B07TW5VH28/ref=sr_1_66?qid=1686556435&s=fashion&sr=1-66,Yellow Chimes Unisex Silver Black Kpop BTS Band Exquisite Signature Jung Kook Silicon Chimes Silver Plated Stainless Steel Charm Bracelet,78,4.4,664
https://www.amazon.ae/Friendship-Adjustable-Hand-Woven-Protection-Jewelry-Black/dp/B088K8C1CK/ref=sr_1_67?qid=1686556435&s=fashion&sr=1-67,The Woo's 2Pcs Evil Eye Bracelets Good Luck Pinky Promise Distance Matching Bracelets for Couple Friendship Family Adjustable Hand-Woven Cords Rope Thread Bracelet Protection Jewelry,79,3.7,12
https://www.amazon.ae/Zaveri-Pearls-Jewellery-Golden-Zpfk6989/dp/B07C2389CW/ref=sr_1_68?qid=1686556435&s=fashion&sr=1-68,Zaveri Pearls Jewellery Set For Women (Golden)(Zpfk6989),80,4.1,"1,325"
https://www.amazon.ae/Simple-Pendant-Necklace-Choker-Valentines/dp/B0B81VKKZ6/ref=sr_1_73?qid=1686556435&s=fashion&sr=1-73,"Simple Gold Love Heart Pendant Necklace Choker Chain Valentine's day Necklace for women, girls and teens.",85,4.2,4
https://www.amazon.ae/Necklace-Artificial-Girlfriend-Birthday-Anniversary/dp/B093771JLS/ref=sr_1_74?qid=1686556435&s=fashion&sr=1-74,"2PCS Pearl Necklace Set, Artificial Pearl Necklace, Pearl Choker Necklace Charm Lady Girlfriend Wedding Birthday Anniversary",86,4.4,"3,605"
https://www.amazon.ae/YouBella-Earrings-Jewellery-Kashmiri-YBEAR_32197/dp/B07KNBGYJ2/ref=sr_1_75?qid=1686556435&s=fashion&sr=1-75,YouBella Earrings for Women Jewellery Earrings Afghani Kashmiri Jhumka earrings for Girls and Women (Silver)(YBEAR_32197),87,3.9,"2,508"
https://www.amazon.ae/Yellow-Piercing-Stylish-Stainless-Earrings/dp/B07CTN7RK4/ref=sr_1_76?qid=1686556435&s=fashion&sr=1-76,Yellow Chimes Non- Piercing COMBO of Stylish Stainless Steel Earrings for Men and Women,88,4.1,"1,280"
https://www.amazon.ae/Yellow-Chimes-Trendy-Stainless-Earrings/dp/B07CTNMVP2/ref=sr_1_77?qid=1686556435&s=fashion&sr=1-77,Yellow Chimes Trendy Stainless Steel Hoops Earrings for Men and Women,89,4,"2,094"
https://www.amazon.ae/Elegant-Fashion-Crystal-designer-Earrings/dp/B07T41QT3R/ref=sr_1_78?qid=1686556435&s=fashion&sr=1-78,Yellow Chimes Elegant Latest Fashion Silver Plated Crystal designer Drop Earrings for Women and Girls (Design 6),90,3.9,612
https://www.amazon.ae/DESIMTION-Multilayer-Christmas-Wristbands-Bracelets/dp/B07HHVPPRJ/ref=sr_1_79?qid=1686556435&s=fashion&sr=1-79,"Inspirational Tree of Life Leather Bracelets for Women,Mothers Day Birthday Jewelry Gifts for Teens Girls",91,4.6,"7,824"
https://www.amazon.ae/Shining-Diva-Fashion-Bracelet-9576b/dp/B078KWDF1N/ref=sr_1_80?qid=1686556435&s=fashion&sr=1-80,Shining Diva Fashion Royal Blue Crystal CZ Silver Plated Stylish Bracelet Gift for Girls Women(9576b),92,2.6,3
https://www.amazon.ae/Piercing-Stainless-Steel-Machines-Earrings/dp/B09XK4ZPL7/ref=sr_1_81?qid=1686556435&s=fashion&sr=1-81,"Ear Piercing Kit, Stainless Steel Body Ear Piercing Tool Set Ear Nose Navel Piercing Machines with 55 Pairs Stainless Steel Stud Earrings for Salon Home Use",93,4.5,2
https://www.amazon.ae/Joyalukkas-GOLD-COIN-2022B4G-4GM/dp/B07TWMJ39Q/ref=sr_1_82?qid=1686556435&s=fashion&sr=1-82,GOLD COIN 4GM,94,5,1
https://www.amazon.ae/Yellow-Platinum-Classic-Crystal-Adjustable/dp/B07DW8GY9N/ref=sr_1_83?qid=1686556435&s=fashion&sr=1-83,Yellow Chimes A5 Grade Platinum Plated Classic Crystal Adjustable Ring for Women and Girls (White),95,4.1,271
https://www.amazon.ae/Swarovski-Elements-Sterling-Crystal-Earrings/dp/B07MCLMT1V/ref=sr_1_84?qid=1686556435&s=fashion&sr=1-84,Swarovski Elements Crystal Gold Plated 925 Sterling Silver Studs Earrings for Women Gift Packing J.Rosée Fashion Jewelry,96,4.1,167
https://www.amazon.ae/Apsvo-Earrings-Lightweight-Waterdrop-Hypoallergenic/dp/B0BWXTBK53/ref=sr_1_85?qid=1686556435&s=fashion&sr=1-85,"Apsvo Chunky Gold Hoop Earrings for Women, Lightweight Waterdrop Hollow Open Hoops, Hypoallergenic Gold Plated Earrings Fashion Jewelry for Women Girls",97,4.3,331
https://www.amazon.ae/Yellow-Handmade-Stylish-Necklace-YCFJNK-153SHELL-WH/dp/B07X7PKYW5/ref=sr_1_86?qid=1686556435&s=fashion&sr=1-86,"Yellow Chimes Women's Cowrie Sea Shell and Base Metal Handmade Beach Stylish Choker Necklace (White, YCFJNK-153SHELL-WH)",98,4.2,163
https://www.amazon.ae/Necklace-Constellation-Necklaces-Jewelry-Horoscope/dp/B09CTKNR21/ref=sr_1_87?qid=1686556435&s=fashion&sr=1-87,12 Zodiac Signs Necklace for Women Girls Constellation Pendant Necklace Horoscope Necklaces for Women 12 Zodiac Sign Necklaces Jewelry Astrology Necklaces,99,3.7,20
